{
  "version": "2025.10.14",
  "date": "2025-10-14",
  "blueprint_id": "tuya_ZG-101Z-D",
  "library_id": "EPMatt",
  "release_id": "awesome",
  "blueprint_file": "tuya_ZG-101Z-D.yaml",
  "supported_integrations": ["ZHA", "Zigbee2MQTT"],
  "breaking": false,
  "changes": [
    {
      "description": "Initial release. ([@yarafie](https://github.com/yarafie)) :tada:"
    }
  ],
  "status": "active"
}
