{
  "blueprint_id": "on_off_schedule_state_persistence",
  "library_id": "EPMatt",
  "release_id": "awesome",
  "version": "2021.10.26",
  "date": "2021-10-26",
  "blueprint_file": "on_off_schedule_state_persistence.yaml",
  "breaking": false,
  "changes": [
    {
      "description": "Standardize blueprint structure and input naming across the collection. Improve blueprint documentation. Remove default values from required inputs. No functionality change.",
      "breaking": false
    }
  ],
  "status": "active"
}
