{
  "version": "2025.05.08",
  "date": "2025-05-08",
  "blueprint_id": "ikea_e2213",
  "library_id": "EPMatt",
  "release_id": "awesome",
  "blueprint_file": "ikea_e2213.yaml",
  "supported_integrations": ["ZHA", "Zigbee2MQTT", "deCONZ"],
  "breaking": false,
  "changes": [
    {
      "description": "Fix deconz actions mappings. [EPMatt-issue#788] ([@yarafie](https://github.com/yarafie))"
    }
  ],
  "status": "active"
}
