{
  "version": "2025.10.16",
  "date": "2025-10-16",
  "blueprint_id": "philips_324131092621",
  "library_id": "EPMatt",
  "release_id": "awesome",
  "blueprint_file": "philips_324131092621.yaml",
  "supported_integrations": ["ZHA", "Zigbee2MQTT", "deCONZ"],
  "breaking": false,
  "changes": [
    {
      "description": "Changed short button presses to use _press_release. ([EPMatt-issue#934](https://github.com/EPMatt/awesome-ha-blueprints/issues/934)) ([@queimadus](https://github.com/queimadus)) ([@yarafie](https://github.com/yarafie))"
    }
  ],
  "status": "active"
}
