{
  "version": "2025.04.19",
  "date": "2025-04-19",
  "blueprint_id": "ikea_e1766",
  "library_id": "EPMatt",
  "release_id": "awesome",
  "blueprint_file": "ikea_e1766.yaml",
  "supported_integrations": ["ZHA", "Zigbee2MQTT", "deCONZ"],
  "breaking": false,
  "changes": [
    {
      "description": "Improve Last Controller Event Helper JSON Regex with more lenient matching."
    }
  ],
  "status": "active"
}
