{
  "version": "2025.10.12",
  "date": "2025-10-12",
  "blueprint_id": "ikea_e1743",
  "library_id": "EPMatt",
  "release_id": "awesome",
  "blueprint_file": "ikea_e1743.yaml",
  "supported_integrations": ["ZHA", "Zigbee2MQTT", "deCONZ"],
  "breaking": false,
  "changes": [
    {
      "description": "Refactored blueprint to use triggers and trigger-id, removed having to supply integration type and removed last controller helper logic. ([@yarafie](https://github.com/yarafie))"
    }
  ],
  "status": "active"
}
