{
  "version": "2025.03.25",
  "date": "2025-03-25",
  "blueprint_id": "shelly_snsn_0024x",
  "library_id": "EPMatt",
  "release_id": "awesome",
  "blueprint_file": "shelly_snsn_0024x.yaml",
  "supported_integrations": ["Shelly"],
  "breaking": false,
  "changes": [
    {
      "description": "Initial release. ([@yarafie](https://github.com/yarafie)) :tada:"
    }
  ],
  "status": "active"
}
