{
  "version": "2025.03.28",
  "date": "2025-03-28",
  "blueprint_id": "ikea_e2123",
  "library_id": "EPMatt",
  "release_id": "awesome",
  "blueprint_file": "ikea_e2123.yaml",
  "supported_integrations": ["ZHA", "Zigbee2MQTT", "deCONZ"],
  "breaking": false,
  "changes": [
    {
      "description": "Initial release. (Thanks [@yarafie](https://github.com/yarafie)) ðŸŽ‰"
    }
  ],
  "status": "active"
}
