{
  "blueprint_id": "addon_update_notification",
  "library_id": "EPMatt",
  "release_id": "awesome",
  "version": "2021.10.26",
  "date": "2021-10-26",
  "blueprint_file": "addon_update_notification.yaml",
  "breaking": false,
  "changes": [
    {
      "description": "Standardize blueprint structure and input naming across the collection. Improve blueprint documentation. No functionality change.",
      "breaking": false
    }
  ],
  "status": "active"
}
