{
  "version": "2025.12.22",
  "date": "2025-12-22",
  "blueprint_id": "aqara_wxkg11lm",
  "library_id": "EPMatt",
  "release_id": "awesome",
  "blueprint_file": "aqara_wxkg11lm.yaml",
  "supported_integrations": ["ZHA", "Zigbee2MQTT", "deCONZ"],
  "breaking": true,
  "changes": [
    {
      "description": "Device Name and Model was corrected to Aqara WXKG11LM as it is a different device from the Xiaomi WXKG01LM. Blueprint will need to be redownloaded and setup again.",
      "breaking": true
    }
  ],
  "status": "active"
}
