{
  "blueprint_id": "light",
  "library_id": "EPMatt",
  "release_id": "awesome",
  "version": "2025.12.22",
  "date": "2025-12-22",
  "blueprint_file": "light.yaml",
  "breaking": true,
  "changes": [
    {
      "description": "Device Name and Model was corrected for both Aqara WXKG11LM and Xiaomi WXKG01LM. Blueprints integrated with these two devices will need to be redownloaded and setup again.",
      "breaking": true
    }
  ],
  "status": "active"
}
