{
  "version": "2025.01.06",
  "date": "2025-01-06",
  "blueprint_id": "ikea_e2001_e2002",
  "library_id": "yarafie",
  "release_id": "anything",
  "blueprint_file": "ikea_e2001_e2002.yaml",
  "supported_integrations": ["Zigbee2MQTT"],
  "breaking": false,
  "changes": [
    {
      "description": "Added new selector filters to support Zigbee2MQTT 2.X. ([@yarafie](https://github.com/yarafie))"
    }
  ],
  "status": "active"
}
